18434000,24 Plus Cafe & Restaurant,1,Coimbatore,"1A, Pollachi Main Road, Eachanari, Podanur, Coimbatore",Podanur,"Podanur, Coimbatore",76.971082,10.96185,"Continental, Fast Food, Desserts, Indian",450,Indian Rupees(Rs.),No,No,No,No,2,3.8,Yellow,Good,24
3000195,Valarmathi Kongunaatu Samayal,1,Coimbatore,"207/A, CSI Compound, Opposite Photo Centre, Race Course, Coimbatore",Race Course,"Race Course, Coimbatore",76.976268,11.001852,"South Indian, Biryani",350,Indian Rupees(Rs.),No,No,No,No,2,4.5,Dark Green,Excellent,380
3000126,Bird On Tree,1,Coimbatore,"28, Opposite Circuit House, Behind HDFC, Race Course, Coimbatore",Race Course,"Race Course, Coimbatore",76.98431119,11.00863836,"Continental, Chinese, Thai, Malaysian, North Indian",1200,Indian Rupees(Rs.),No,No,No,No,3,3.8,Yellow,Good,221
18280306,Tim's Bistro,1,Coimbatore,"156, Race Course Road, Race Course, Coimbatore",Race Course,"Race Course, Coimbatore",76.9754397,11.0030085,"North Indian, Continental",700,Indian Rupees(Rs.),No,Yes,No,No,2,3.9,Yellow,Good,85
3001489,Batlivala & Khanabhoy,1,Coimbatore,"122, 4th Floor, Appusamy Layout, Red Fields, Race Course, Coimbatore",Race Course,"Race Course, Coimbatore",76.98624135,11.00175265,"Parsi, North Indian",1200,Indian Rupees(Rs.),No,No,No,No,3,4.2,Green,Very Good,40
3000770,Cafe Totaram,1,Coimbatore,"245/1, Near Veejay Hall, Raheja Apartment, Race Course, Coimbatore",Race Course,"Race Course, Coimbatore",76.98187642,11.00076241,"Cafe, Fast Food",600,Indian Rupees(Rs.),No,Yes,No,No,2,4,Green,Very Good,132
3000062,Cream Centre,1,Coimbatore,"128/180, Orbit Avenue, Thirugnanasambandam Road, Opposite Bishop Appasamy College, Gopalapuram, Race Course, Coimbatore",Race Course,"Race Course, Coimbatore",76.97649444,11.00366944,"North Indian, Chinese, Italian, Mexican",1000,Indian Rupees(Rs.),No,No,No,No,3,4,Green,Very Good,203
3000016,On The Go,1,Coimbatore,"167, Race Course Road, Gopalapuram, Race Course, Coimbatore",Race Course,"Race Course, Coimbatore",76.975525,11.00368056,"Italian, North Indian, Desserts",1500,Indian Rupees(Rs.),No,No,No,No,4,4,Green,Very Good,215
3000014,Sree Annapoorna,1,Coimbatore,"75, East Arokiasamy Road, RS Puram, Coimbatore",RS Puram,"RS Puram, Coimbatore",76.95173611,11.00668611,"South Indian, North Indian, Chinese",400,Indian Rupees(Rs.),No,No,No,No,2,4.3,Green,Very Good,225
3000001,That's Y Food,1,Coimbatore,"24/49, TV Swamy Road East, Opposite Emeral Building, RS Puram, Coimbatore",RS Puram,"RS Puram, Coimbatore",76.95295,11.010375,"North Indian, Biryani",1400,Indian Rupees(Rs.),No,No,No,No,3,4.2,Green,Very Good,299
3001321,CakeBee,1,Coimbatore,"6/1, SRP Nagar, Saibaba Colony, Coimbatore",Saibaba Colony,"Saibaba Colony, Coimbatore",76.94465239,11.02611735,"Bakery, Desserts",350,Indian Rupees(Rs.),No,Yes,No,No,2,4.9,Dark Green,Excellent,200
3000996,Yari,1,Coimbatore,"69, Bharathi Park, 6th Cross, Saibaba Colony, Coimbatore",Saibaba Colony,"Saibaba Colony, Coimbatore",76.940432,11.02091,"North Indian, Chinese, Street Food",700,Indian Rupees(Rs.),No,No,No,No,2,4.2,Green,Very Good,221
3001065,Cream Stone,1,Coimbatore,"Creamstone , 1335, Avinashi Road, Opposite Bharath Petrol Bunk, Peelamedu, Coimbatore","SMS Hotel, Peelamedu","SMS Hotel, Peelamedu, Coimbatore",76.9983492,11.02229761,"Desserts, Ice Cream",300,Indian Rupees(Rs.),No,No,No,No,1,4.3,Green,Very Good,161
3000048,Barbeque Nation,1,Coimbatore,"6th Floor, Metro Park Inn, 1000, Raja Street, Near Clock Tower, Town Hall, Coimbatore",Town Hall,"Town Hall, Coimbatore",76.96330278,10.99413611,"North Indian, European, Mediterranean",1400,Indian Rupees(Rs.),No,No,No,No,3,4.4,Green,Very Good,505
3500012,The Punjabi Essence Restaurant,1,Dehradun,"27 B, Near Premier Plaza, Rajpur Road, Chukkuwala, Dehradun",Chukkuwala,"Chukkuwala, Dehradun",0,0,"North Indian, Chinese",800,Indian Rupees(Rs.),No,No,No,No,3,3.6,Yellow,Good,102
3500007,Tirupati Restaurant,1,Dehradun,"27 B, Rajpur Road, Opposite St. Joseph's Academy, Chukkuwala, Dehradun",Chukkuwala,"Chukkuwala, Dehradun",0,0,"South Indian, North Indian, Chinese",500,Indian Rupees(Rs.),No,No,No,No,3,3.8,Yellow,Good,115
3500017,Anandam,1,Dehradun,"69, Krishna Tower, Rajpur Road, Hathibarkala Salwala, Dehradun",Hathibarkala Salwala,"Hathibarkala Salwala, Dehradun",78.053162,30.335259,"Desserts, North Indian, Chinese, South Indian, Fast Food, Street Food",650,Indian Rupees(Rs.),No,No,No,No,3,3.9,Yellow,Good,141
3500018,Town Table Restaurant,1,Dehradun,"101, Rajpur Road, Hathibarkala Salwala, Dehradun",Hathibarkala Salwala,"Hathibarkala Salwala, Dehradun",78.060221,30.340722,"North Indian, Chinese, Continental",1000,Indian Rupees(Rs.),No,No,No,No,4,3.9,Yellow,Good,173
3500011,Kalsang Friends Corner,1,Dehradun,"88 A, Opposite Osho, Chander Lok Colony, Rajpur Road, Hathibarkala Salwala, Dehradun",Hathibarkala Salwala,"Hathibarkala Salwala, Dehradun",78.062543,30.346994,"Chinese, Thai, Tibetan",750,Indian Rupees(Rs.),No,No,No,No,3,4.2,Green,Very Good,406
18416632,The Great Indian Pub,1,Dehradun,"138/345, Rajpur Road, Jakhan, Dehradun",Jakhan,"Jakhan, Dehradun",78.06802238,30.36128079,North Indian,1500,Indian Rupees(Rs.),No,No,No,No,4,4.9,Dark Green,Excellent,50
18279289,BMG - All Day Dining,1,Dehradun,"140 A, Rajpur Road, Jakhan, Dehradun",Jakhan,"Jakhan, Dehradun",78.06888981,30.36268594,"Chinese, North Indian, Fast Food",0,Indian Rupees(Rs.),No,No,No,No,1,4.3,Green,Very Good,63
18408585,Punjab Grill,1,Dehradun,"Rajpur Road, Jakhan, Dehradun",Jakhan,"Jakhan, Dehradun",78.067079,30.359722,"Mughlai, North Indian",1250,Indian Rupees(Rs.),No,No,No,No,4,4,Green,Very Good,98
3500059,TBistro,1,Dehradun,"Saina Inn, 3, Old Survey Road, Karanpur, Dehradun",Karanpur,"Karanpur, Dehradun",78.054222,30.332735,"North Indian, Chinese",550,Indian Rupees(Rs.),No,No,No,No,3,3.8,Yellow,Good,230
3500081,Y Cafe & Restaurant,1,Dehradun,"Hotel White House, Behind St. Joseph's Academy, Subhash Road, Karanpur, Dehradun",Karanpur,"Karanpur, Dehradun",78.049117,30.328174,Cafe,500,Indian Rupees(Rs.),No,No,No,No,3,4,Green,Very Good,94
17971273,Eddie's Patisserie,1,Dehradun,"102 Yamuna Colony, Above Punjab National Bank, Chakrata Road, Dehradun",Krishna Nagar,"Krishna Nagar, Dehradun",0,0,Bakery,350,Indian Rupees(Rs.),No,No,No,No,2,4.1,Green,Very Good,64
3500365,First Gear Cafe,1,Dehradun,"Khala Gaon, Near Shiv Mandir, Malsi, Dehradun",Malsi,"Malsi, Dehradun",0,0,"Cafe, Chinese",700,Indian Rupees(Rs.),No,No,No,No,3,3.9,Yellow,Good,131
3500013,Dunkin Donuts,1,Dehradun,"UG 03, Pacific Mall, Rajpur Road, Jakhan, Dehradun","Pacific Mall, Jakhan","Pacific Mall, Jakhan, Dehradun",78.070453,30.366322,"Burger, Desserts",600,Indian Rupees(Rs.),No,No,No,No,3,3.9,Yellow,Good,101
3500024,Doon Darbar,1,Dehradun,"43, Gandhi Road, Paltan Bazaar, Dehradun",Paltan Bazaar,"Paltan Bazaar, Dehradun",78.04026667,30.31952778,"North Indian, Mughlai",600,Indian Rupees(Rs.),No,No,No,No,3,3.9,Yellow,Good,121
3500488,Razzmatazz,1,Dehradun,"5, Pritam Road, Dalanwala, Near Race Course, Dehradun",Race Course,"Race Course, Dehradun",0,0,Cafe,400,Indian Rupees(Rs.),No,No,No,No,2,3.9,Yellow,Good,39
3500505,Barbeque Nation,1,Dehradun,"Chaudhary Plaza, Rajpur Road, Rajpur, Dehradun",Rajpur,"Rajpur, Dehradun",78.061187,30.3425093,"North Indian, Mediterranean, Asian, Chinese",1600,Indian Rupees(Rs.),No,No,No,No,4,4.4,Green,Very Good,66
3500010,Black Pepper Restaurant,1,Dehradun,"3, Astley Hall, Rajpur Road, Rajpur, Dehradun",Rajpur,"Rajpur, Dehradun",78.046106,30.327968,"North Indian, Chinese",1200,Indian Rupees(Rs.),No,No,No,No,4,4,Green,Very Good,175
3500414,Cafe Marigold,1,Dehradun,"Near Shehanshahi Ashram, Old Mussorie Road, Rajpur, Dehradun",Rajpur,"Rajpur, Dehradun",0,0,"Cafe, Chinese, Fast Food",500,Indian Rupees(Rs.),No,No,No,No,3,4.1,Green,Very Good,104
18440677,Jalapenos,1,Dehradun,"Mussourie Diversion, Pacific Hills,Rajpur Road, Rajpur, Dehradun",Rajpur,"Rajpur, Dehradun",78.07715102,30.37220198,"Cafe, Mexican",500,Indian Rupees(Rs.),No,No,No,No,3,4.2,Green,Very Good,68
3500484,Kalsang AMA Cafe,1,Dehradun,"88, Opposite Osho, Chander Lok Colony, Rajpur Road, Rajpur, Dehradun",Rajpur,"Rajpur, Dehradun",0,0,Cafe,600,Indian Rupees(Rs.),No,No,No,No,3,4.2,Green,Very Good,89
301728,Desire Foods,1,Faridabad,"G 25/22, Main Road, 40 Feet, Molarband Extension, Badarpur Border, Faridabad",Badarpur Border,"Badarpur Border, Faridabad",77.3066401,28.4900591,"Chinese, Fast Food, Bakery",250,Indian Rupees(Rs.),No,No,No,No,1,2.9,Orange,Average,4
5992,Knight Rock,1,Faridabad,"11/6, Delhi Mathura Road, Near Bharat Petrol Pump, Badarpur Border, Faridabad",Badarpur Border,"Badarpur Border, Faridabad",77.304776,28.4901567,"North Indian, Chinese",500,Indian Rupees(Rs.),No,No,No,No,2,2.8,Orange,Average,16
301730,Punjab Restaurant,1,Faridabad,"Main 40 Feet Road, Molarband Extension, Badarpur Border, Faridabad",Badarpur Border,"Badarpur Border, Faridabad",77.305563,28.4901368,North Indian,150,Indian Rupees(Rs.),No,No,No,No,1,2.8,Orange,Average,8
301729,Raju Dhaba,1,Faridabad,"Main 40 Feet Road, Molarband Extension, Badarpur Border, Faridabad",Badarpur Border,"Badarpur Border, Faridabad",77.3061016,28.4900979,North Indian,150,Indian Rupees(Rs.),No,No,No,No,1,2.9,Orange,Average,8
301731,Rakheja Bakery,1,Faridabad,"Main 40 Feet Road, Molarband Extension, Badarpur Border, Faridabad",Badarpur Border,"Badarpur Border, Faridabad",77.3057446,28.490062,Bakery,100,Indian Rupees(Rs.),No,No,No,No,1,2.8,Orange,Average,7
311053,Snax Points,1,Faridabad,"A-68/5, Near Mehra Petrol Pump, Main Tajpur Road, Badarpur Border, Faridabad",Badarpur Border,"Badarpur Border, Faridabad",77.3053835,28.4901198,"Chinese, North Indian, Fast Food",300,Indian Rupees(Rs.),No,No,No,No,1,3,Orange,Average,4
9299,Aggarwal Sweet Corner,1,Faridabad,"Badarpur Border Chowk Post, Badarpur Border, Faridabad",Badarpur Border,"Badarpur Border, Faridabad",77.30274167,28.49629167,Mithai,100,Indian Rupees(Rs.),No,No,No,No,1,0,White,Not rated,1
9178,Kashyap Vaishno Dhaba,1,Faridabad,"Near Seble Cinema, Dharamveer Market, Badarpur Border, Faridabad",Badarpur Border,"Badarpur Border, Faridabad",77.303542,28.4959154,North Indian,100,Indian Rupees(Rs.),No,No,No,No,1,0,White,Not rated,3
18477319,Total Food Court,1,Faridabad,"B-222, Shishram Complex, Main Market, Badarpur Border, Faridabad",Badarpur Border,"Badarpur Border, Faridabad",0,0,"North Indian, Mughlai, Chinese",400,Indian Rupees(Rs.),No,No,No,No,1,0,White,Not rated,3
18433852,The Chaiwalas,1,Faridabad,"Sector 21 A, Asian Hospital, Badhkal Chowk, Badkal Lake, Faridabad",Badkal Lake,"Badkal Lake, Faridabad",77.3000877,28.4262842,Cafe,300,Indian Rupees(Rs.),No,No,No,No,1,0,White,Not rated,0
304046,Cafe And More,1,Faridabad,"UGF 22, Charmwood Plaza, Eros Garden, Charmwood Village, Faridabad",Charmwood Village,"Charmwood Village, Faridabad",77.2905651,28.4946638,"Fast Food, North Indian",300,Indian Rupees(Rs.),No,No,No,No,1,2.9,Orange,Average,4
309936,Green Chick Chop,1,Faridabad,"UG 58, Charmwood Plaza, Eros Garden Colony, Suraj Kund Road, Charmwood Village, Faridabad",Charmwood Village,"Charmwood Village, Faridabad",77.2905276,28.4946804,"Raw Meats, North Indian, Fast Food",350,Indian Rupees(Rs.),No,No,No,No,1,3,Orange,Average,7
309927,Kolkata Hot Kathi Rolls,1,Faridabad,"Deepak Complex, Near Eros Garden, Charmwood Village, Faridabad",Charmwood Village,"Charmwood Village, Faridabad",77.2918292,28.4922473,"Fast Food, Chinese",300,Indian Rupees(Rs.),No,No,No,No,1,2.9,Orange,Average,11
18377449,Aapki Rasoi,1,Faridabad,"HR-227, 60 Feet Road, Pul Pehlad Pur, Charmwood Village, Faridabad",Charmwood Village,"Charmwood Village, Faridabad",77.2918292,28.4990636,North Indian,200,Indian Rupees(Rs.),No,No,No,No,1,0,White,Not rated,1
18465871,Fusion Food Corner,1,Faridabad,"158/7, Opposite DDA Flat, Pul Pehlad Pur, Charmwood Village, Faridabad",Charmwood Village,"Charmwood Village, Faridabad",0,0,"North Indian, Chinese",300,Indian Rupees(Rs.),No,No,No,No,1,0,White,Not rated,0
18472646,Punjabi Rasoi,1,Faridabad,"1, Deepak Complex, Eros Charmwood Village, Faridabad",Charmwood Village,"Charmwood Village, Faridabad",77.292431,28.4923251,North Indian,400,Indian Rupees(Rs.),No,No,No,No,1,0,White,Not rated,0
18037826,Kebab Xpress,1,Faridabad,"Shop 23-24, 2nd Floor, Crown Interiorz Mall, Sector 35, Faridabad","Crown Interiorz Mall, Sector 35, Faridabad","Crown Interiorz Mall, Sector 35, Faridabad, Faridabad",77.3074479,28.4698631,"North Indian, Mughlai",600,Indian Rupees(Rs.),No,Yes,No,No,2,2.8,Orange,Average,49
301163,McDonald's,1,Faridabad,"12/7, 2nd Floor, Crown Interiorz Mall, Sector 35, Faridabad","Crown Interiorz Mall, Sector 35, Faridabad","Crown Interiorz Mall, Sector 35, Faridabad, Faridabad",77.3074479,28.4695043,"Fast Food, Burger",500,Indian Rupees(Rs.),No,No,No,No,2,3.4,Orange,Average,58
4931,Suruchi,1,Faridabad,"29, 2nd Floor, Crown Interiorz Mall, Sector 35, Faridabad","Crown Interiorz Mall, Sector 35, Faridabad","Crown Interiorz Mall, Sector 35, Faridabad, Faridabad",77.3074479,28.4701322,"North Indian, South Indian, Gujarati, Rajasthani",700,Indian Rupees(Rs.),No,No,No,No,2,3.4,Orange,Average,233
1804,Berco's,1,Faridabad,"Shop R-2, 3rd Floor, Crown Interiorz Mall, Sector 35, Faridabad","Crown Interiorz Mall, Sector 35, Faridabad","Crown Interiorz Mall, Sector 35, Faridabad, Faridabad",77.3072684,28.4700256,"Chinese, Thai",1100,Indian Rupees(Rs.),No,Yes,No,No,3,3.8,Yellow,Good,508
312102,Dunkin' Donuts,1,Faridabad,"3, 2nd Floor, Crown Interiorz Mall, Near Toll Bridge, Sector 35, Faridabad","Crown Interiorz Mall, Sector 35, Faridabad","Crown Interiorz Mall, Sector 35, Faridabad, Faridabad",77.3074031,28.4693655,"Burger, Desserts, Fast Food",600,Indian Rupees(Rs.),No,Yes,No,No,2,3.6,Yellow,Good,98
18217857,The Chocolate Room,1,Faridabad,"10, 2nd Floor, Crown Interiorz Mall, Sector 35, Faridabad","Crown Interiorz Mall, Sector 35, Faridabad","Crown Interiorz Mall, Sector 35, Faridabad, Faridabad",77.3074031,28.4693655,"Cafe, Desserts",900,Indian Rupees(Rs.),No,Yes,No,No,2,3.6,Yellow,Good,59
18471268,Baskin Robbin,1,Faridabad,"Ground Floor, Crown Interiorz Mall, Sector 35, Faridabad","Crown Interiorz Mall, Sector 35, Faridabad","Crown Interiorz Mall, Sector 35, Faridabad, Faridabad",77.3074479,28.469594,Desserts,300,Indian Rupees(Rs.),No,No,No,No,1,0,White,Not rated,0
18381244,Popcorn Fusion,1,Faridabad,"Crown Interiorz Mall, Sector 35, Faridabad","Crown Interiorz Mall, Sector 35, Faridabad","Crown Interiorz Mall, Sector 35, Faridabad, Faridabad",77.3074031,28.4693655,Fast Food,200,Indian Rupees(Rs.),No,No,No,No,1,0,White,Not rated,1
18408041,Subway,1,Faridabad,"SF 25, 2nd Floor, Sector 35, Faridabad","Crown Interiorz Mall, Sector 35, Faridabad","Crown Interiorz Mall, Sector 35, Faridabad, Faridabad",77.3074928,28.4700019,"American, Fast Food, Salad, Healthy Food",500,Indian Rupees(Rs.),No,No,No,No,2,0,White,Not rated,2
311051,KFC,1,Faridabad,"Shops 21-22, 2nd Floor, Crown Interiorz Mall, Sector 35, Faridabad","Crown Interiorz Mall, Sector 35, Faridabad","Crown Interiorz Mall, Sector 35, Faridabad, Faridabad",77.30706006,28.46980656,"American, Fast Food, Burger",500,Indian Rupees(Rs.),No,Yes,No,No,2,2.1,Red,Poor,57
18133510,Barbeque Nation,1,Faridabad,"2nd Floor, Crown Interiorz Mall, Sector 35, Faridabad","Crown Interiorz Mall, Sector 35, Faridabad","Crown Interiorz Mall, Sector 35, Faridabad, Faridabad",77.3073785,28.4698629,North Indian,1600,Indian Rupees(Rs.),No,No,No,No,3,4,Green,Very Good,299
308380,Yo! China,1,Faridabad,"S-2, 2nd Floor, Crown Interiorz Mall, Sector 35, Faridabad","Crown Interiorz Mall, Sector 35, Faridabad","Crown Interiorz Mall, Sector 35, Faridabad, Faridabad",77.3074031,28.4693655,Chinese,1300,Indian Rupees(Rs.),No,Yes,No,No,3,4.1,Green,Very Good,239
6077,Giani's,1,Faridabad,"Food Court, Crown Plaza Mall, Sector 15-A,  Near, Sector 15, Faridabad","Crown Plaza Mall, Sector 15, Faridabad","Crown Plaza Mall, Sector 15, Faridabad, Faridabad",77.3130127,28.3980691,"Ice Cream, Desserts",400,Indian Rupees(Rs.),No,No,No,No,1,3.2,Orange,Average,16
308082,Momo-Cha,1,Faridabad,"Crown Plaza Mall, Sector 15, Faridabad","Crown Plaza Mall, Sector 15, Faridabad","Crown Plaza Mall, Sector 15, Faridabad, Faridabad",77.3130127,28.3979794,Fast Food,200,Indian Rupees(Rs.),No,Yes,No,No,1,2.7,Orange,Average,16
309558,Shree Rathnam,1,Faridabad,"LG-28, Crown Plaza Mall, Sector 15-A, Sector 15, Faridabad","Crown Plaza Mall, Sector 15, Faridabad","Crown Plaza Mall, Sector 15, Faridabad, Faridabad",77.3128332,28.397424,"South Indian, North Indian, Chinese",800,Indian Rupees(Rs.),No,Yes,No,No,2,3.4,Orange,Average,48
8128,Mirage Restro Bar,1,Faridabad,"2nd Floor, Crown Plaza Mall, Sector 15-A, Sector 15, Faridabad","Crown Plaza Mall, Sector 15, Faridabad","Crown Plaza Mall, Sector 15, Faridabad, Faridabad",77.3131025,28.3978083,"North Indian, Mughlai",1000,Indian Rupees(Rs.),Yes,No,No,No,3,2.4,Red,Poor,25
304062,Jai Jagannath Hotel,1,Faridabad,"E 51, Shiv Durga Vihar, Dayal Bagh, Faridabad",Dayal Bagh,"Dayal Bagh, Faridabad",77.294319,28.4937692,South Indian,200,Indian Rupees(Rs.),No,No,No,No,1,0,White,Not rated,3
9785,Gelato Vinto,1,Faridabad,"40 GF, Eldeco Station 1 Mall, Sector 12, Faridabad","Eldeco Station 1 Mall, Sector 12, Faridabad","Eldeco Station 1 Mall, Sector 12, Faridabad, Faridabad",77.3139102,28.3868454,"Desserts, Ice Cream",250,Indian Rupees(Rs.),No,No,No,No,1,2.8,Orange,Average,12
312514,Maggi Point,1,Faridabad,"F-46 A, 1st Floor, Eldeco Mall, Sector 12, Faridabad","Eldeco Station 1 Mall, Sector 12, Faridabad","Eldeco Station 1 Mall, Sector 12, Faridabad, Faridabad",77.3140449,28.3869029,Fast Food,200,Indian Rupees(Rs.),No,No,No,No,1,0,White,Not rated,2
308961,Angaar,1,Faridabad,"Hotel Saffron Kiran, 12/6, Adjacent to Badarpur Toll, NH-2, Sector 35, Faridabad","Hotel Saffron Kiran, Faridabad","Hotel Saffron Kiran, Faridabad, Faridabad",77.3056977,28.4719854,"North Indian, Chinese",1200,Indian Rupees(Rs.),Yes,No,No,No,3,0,White,Not rated,0
308963,TcozY,1,Faridabad,"Hotel Saffron Kiran, 12/6, Adjacent to Badarpur Toll, NH-2, Sector 35, Faridabad","Hotel Saffron Kiran, Faridabad","Hotel Saffron Kiran, Faridabad, Faridabad",77.3066401,28.4722089,Cafe,1500,Indian Rupees(Rs.),No,No,No,No,3,0,White,Not rated,0
308962,The Retriever,1,Faridabad,"Hotel Saffron Kiran, 12/6, Adjacent to Badarpur Toll, NH-2, Sector 35, Faridabad","Hotel Saffron Kiran, Faridabad","Hotel Saffron Kiran, Faridabad, Faridabad",77.3062507,28.4723428,"North Indian, Mughlai, Chinese",1500,Indian Rupees(Rs.),Yes,No,No,No,3,0,White,Not rated,0
8169,Bangali Sweets & Restaurant,1,Faridabad,"6, Plot 17, New DLF, Indraprastha Colony, Faridabad",Indraprastha Colony,"Indraprastha Colony, Faridabad",77.3153578,28.4534629,Mithai,100,Indian Rupees(Rs.),No,No,No,No,1,0,White,Not rated,2
309368,Silver,1,Faridabad,"K Hotel, Plot 2, Behind Pristine Mall, Sector 31, Faridabad",K Hotel,"K Hotel, Faridabad",77.316429,28.446715,"North Indian, Chinese, Continental",1500,Indian Rupees(Rs.),Yes,No,No,No,3,0,White,Not rated,3
18472429,Chill 'N Grill,1,Faridabad,"3C-188, Opposite Bharat Optical, NIT, Faridabad",NIT,"NIT, Faridabad",77.2900667,28.3954463,North Indian,300,Indian Rupees(Rs.),No,No,No,No,1,0,White,Not rated,0
18472418,Punjabi Restaurant,1,Faridabad,"3F/49, Sainik Colony Road, NIT, Faridabad",NIT,"NIT, Faridabad",77.2874809,28.3939512,"North Indian, Mughlai",500,Indian Rupees(Rs.),No,No,No,No,2,0,White,Not rated,0
18472426,Standard Chicken Point,1,Faridabad,"3F/90, Sainik Colony Road, NIT Faridabad",NIT,"NIT, Faridabad",77.2875524,28.3940171,Mughlai,500,Indian Rupees(Rs.),No,No,No,No,2,0,White,Not rated,0
18450934,The Grillz & Gravy,1,Faridabad,"3G/1, NIT, Faridabad",NIT,"NIT, Faridabad",77.2922781,28.3982684,"North Indian, Chinese",400,Indian Rupees(Rs.),No,No,No,No,1,0,White,Not rated,0
6025,Cakes 'n Bakes - Park Plaza,1,Faridabad,"Park Plaza, Sector 21 C, Sector 21, Faridabad","Park Plaza, Sector 21, Faridabad","Park Plaza, Sector 21, Faridabad, Faridabad",77.2969459,28.4292178,Bakery,1000,Indian Rupees(Rs.),No,No,No,No,3,3,Orange,Average,15
6013,Cafe Bite,1,Faridabad,"UGF 35, Parsvanath City Mall, Sector 12, Faridabad","Parsavnath City Mall, Sector 12, Faridabad","Parsavnath City Mall, Sector 12, Faridabad, Faridabad",77.3144487,28.383665,Cafe,500,Indian Rupees(Rs.),No,No,No,No,2,3.2,Orange,Average,19
8153,Cafe Light,1,Faridabad,"Shop 38, Upper Ground Floor, Parsvnath City Mall, Sector 12, Faridabad","Parsavnath City Mall, Sector 12, Faridabad","Parsavnath City Mall, Sector 12, Faridabad, Faridabad",77.3144877,28.3837046,"Cafe, Chinese, Fast Food",500,Indian Rupees(Rs.),No,No,No,No,2,2.8,Orange,Average,8
18471296,Little Cafe,1,Faridabad,"Shop 32, Upper Ground Floor, Parsvnath City Mall, Sector 12, Faridabad","Parsavnath City Mall, Sector 12, Faridabad","Parsavnath City Mall, Sector 12, Faridabad, Faridabad",77.3145373,28.3836738,"Fast Food, Beverages",300,Indian Rupees(Rs.),No,No,No,No,1,0,White,Not rated,0
18279477,Momo-Cha,1,Faridabad,"J-121, Near Lean Wolf Gym, Sector 10, Faridabad",Sector 10,"Sector 10, Faridabad",77.3291609,28.3754863,"North Indian, Chinese",450,Indian Rupees(Rs.),No,No,No,No,1,2.8,Orange,Average,20
18359331,Oregano India,1,Faridabad,"Shop 2661, Sector 7-10 Market, YMCA Road, Sector 10, Faridabad",Sector 10,"Sector 10, Faridabad",77.3266079,28.3689797,"Fast Food, Chinese, Italian",500,Indian Rupees(Rs.),No,No,No,No,2,3.1,Orange,Average,11
301151,Sagar Bakery,1,Faridabad,"938, 7-10 Chowk, YMCA Road, Sector 10, Faridabad",Sector 10,"Sector 10, Faridabad",77.3270132,28.3692291,Bakery,150,Indian Rupees(Rs.),No,No,No,No,1,3,Orange,Average,11
18204479,Smugglers,1,Faridabad,"Near Big Bus, Sector 9-10 Road, Sector 10, Faridabad",Sector 10,"Sector 10, Faridabad",77.329628,28.3702087,North Indian,450,Indian Rupees(Rs.),No,Yes,No,No,1,3.1,Orange,Average,7
2198,Welcome,1,Faridabad,"J140, Sector 10, Faridabad",Sector 10,"Sector 10, Faridabad",77.3288978,28.3777541,"North Indian, Chinese",700,Indian Rupees(Rs.),Yes,No,No,No,2,2.9,Orange,Average,13
18434243,Giani's,1,Faridabad,"Sector 10, Faridabad",Sector 10,"Sector 10, Faridabad",77.3270132,28.3692291,"Ice Cream, Desserts",400,Indian Rupees(Rs.),No,No,No,No,1,0,White,Not rated,0
18273628,Invitation,1,Faridabad,"Invitation Inn Banquet & Rooms, DLF Sector 10, Faridabad",Sector 10,"Sector 10, Faridabad",0,0,North Indian,700,Indian Rupees(Rs.),No,No,No,No,2,0,White,Not rated,3
18471262,New Dilight,1,Faridabad,"H - 147, Sector 10, Faridabad",Sector 10,"Sector 10, Faridabad",77.3295018,28.3730138,"North Indian, Mughlai, Chinese",500,Indian Rupees(Rs.),No,No,No,No,2,0,White,Not rated,0
18258480,Chimney,1,Faridabad,"SCF 9, Near Bank of India, Sector 11, Faridabad",Sector 11,"Sector 11, Faridabad",77.319026,28.3725172,"North Indian, Mughlai, Chinese",800,Indian Rupees(Rs.),Yes,Yes,No,No,2,3.3,Orange,Average,25
9698,Chopstick,1,Faridabad,"Booth 15, Sector 11, Faridabad",Sector 11,"Sector 11, Faridabad",77.3185858,28.371835,Chinese,300,Indian Rupees(Rs.),No,No,No,No,1,3,Orange,Average,22
8326,Hot & Tasty Chinese Food,1,Faridabad,"18, DLF Market, Sector 11, Faridabad",Sector 11,"Sector 11, Faridabad",77.3184832,28.3719511,"North Indian, Chinese",450,Indian Rupees(Rs.),No,No,No,No,1,2.6,Orange,Average,26
18270379,Sanjha Chulha,1,Faridabad,"Plot 1-A, Sector 11-D, Sector 11, Faridabad",Sector 11,"Sector 11, Faridabad",77.32157,28.3692881,"North Indian, Mughlai",700,Indian Rupees(Rs.),No,Yes,No,No,2,2.9,Orange,Average,16
304006,Frontier,1,Faridabad,"Ground Floor, Parsvnath CIty Mall, Sector 12, Faridabad",Sector 12,"Sector 12, Faridabad",77.31429167,28.38339444,Bakery,200,Indian Rupees(Rs.),No,No,No,No,1,2.9,Orange,Average,7
308957,Oxy Lounge,1,Faridabad,"Town Park, Opposite District Court, Sector 12, Faridabad",Sector 12,"Sector 12, Faridabad",77.3244365,28.384502,"North Indian, Chinese, Italian",1500,Indian Rupees(Rs.),Yes,Yes,No,No,3,3.1,Orange,Average,28
18427216,City Dhaba,1,Faridabad,"11-12 Dividing Road, Sector 12, Faridabad",Sector 12,"Sector 12, Faridabad",77.3144456,28.3811924,"North Indian, Chinese",550,Indian Rupees(Rs.),No,No,No,No,2,0,White,Not rated,0
18433315,Garam Masala,1,Faridabad,"Plot 6, Bata Chowk, BIryaniwali Gali, Sector 12, Faridabad",Sector 12,"Sector 12, Faridabad",0,0,"North Indian, Chinese",400,Indian Rupees(Rs.),No,No,No,No,1,0,White,Not rated,0
8266,Mittal Fast Food,1,Faridabad,"10, Town Park, Sector 12, Faridabad",Sector 12,"Sector 12, Faridabad",77.32425,28.38471389,Fast Food,100,Indian Rupees(Rs.),No,No,No,No,1,0,White,Not rated,0
18383469,Al Bake,1,Faridabad,"SCF 58, Ground Floor, Sector 15, Faridabad",Sector 15,"Sector 15, Faridabad",77.3229299,28.395009,"North Indian, Chinese",600,Indian Rupees(Rs.),No,Yes,No,No,2,3.2,Orange,Average,31
1367,Anupam Sweet,1,Faridabad,"SCF 74, Sector 15 Market, Sector 15, Faridabad",Sector 15,"Sector 15, Faridabad",77.3222568,28.3949008,"North Indian, South Indian, Chinese, Fast Food, Mithai",400,Indian Rupees(Rs.),No,No,No,No,1,3.4,Orange,Average,70
9650,Cafe Coffee Day,1,Faridabad,"SCF 42, Shopping Centre, Main Huda Market, Sector 15, Faridabad",Sector 15,"Sector 15, Faridabad",77.3236112,28.3952671,Cafe,450,Indian Rupees(Rs.),No,No,No,No,1,3.3,Orange,Average,67
308335,Chicago Pizza,1,Faridabad,"Booth Number 135, Main Market, Sector 15, Faridabad",Sector 15,"Sector 15, Faridabad",77.3217184,28.3950296,Pizza,600,Indian Rupees(Rs.),No,No,No,No,2,2.7,Orange,Average,35
18391065,Crispy Crust,1,Faridabad,"Shop 19, HUDA Market, Opposite Mother Dairy, Sector 15, Faridabad",Sector 15,"Sector 15, Faridabad",77.3241683,28.3950992,"North Indian, Chinese, Fast Food",500,Indian Rupees(Rs.),No,Yes,No,No,2,3.4,Orange,Average,22
301193,Frontier,1,Faridabad,"SCO 46, Main Market, Sector 15, Faridabad",Sector 15,"Sector 15, Faridabad",77.3235114,28.3951274,Bakery,200,Indian Rupees(Rs.),No,No,No,No,1,3.3,Orange,Average,17
